{
  "schema": "voxprint-model/1",
  "id": "moss-image-sft-fp8",
  "display_name": "MOSS-Image SFT DiT FP8",
  "app_ids": [
    "canvas"
  ],
  "task": "text-to-image",
  "license": "apache-2.0",
  "files": [
    {
      "path": "LICENSE",
      "size": 11358,
      "sha256": "cfc7749b96f63bd31c3c42b5c471bf756814053e847c10f3eb003417bc523d30"
    },
    {
      "path": "NOTICE",
      "size": 469,
      "sha256": "60400d546aa7e52219424c2759135f407248b168081aa88bcbd2e8b796341bd0"
    },
    {
      "path": "README.md",
      "size": 2137,
      "sha256": "4a7747e5eb662ae7b27629da55f665d3408ac1beb61a673db94496dd2428d49f"
    },
    {
      "path": "dit-fp8.safetensors",
      "size": 0,
      "sha256": "0000000000000000000000000000000000000000000000000000000000000000"
    }
  ],
  "mirrors": [
    {
      "kind": "hf",
      "ref": "Mitroshenkov87/voxprint-mirror-moss-image-sft-fp8",
      "revision": "unpublished",
      "ours": true
    }
  ],
  "tier": {
    "min_vram_gib": 15.5,
    "recommended_vram_gib": 15.5,
    "gpu_min_cc": 8.0
  },
  "runtime": {
    "engine": "diffusers",
    "version_req": ">=0.38"
  },
  "base_model": "OpenMOSS-Team/MOSS-Image-SFT",
  "card_url": "https://huggingface.co/Mitroshenkov87/voxprint-mirror-moss-image-sft-fp8",
  "flags": [
    "derivative",
    "modified",
    "fallback=quantize-bf16",
    "source-repo=OpenMOSS-Team/MOSS-Image-SFT",
    "source-revision=fc5de0d56fc910cbca6f6625a70f5f582b26deb1",
    "source-mirror=Mitroshenkov87/voxprint-mirror-moss-image-sft",
    "torchao=0.18.0",
    "quant=float8_e4m3fn,per_row,v2",
    "source-sha=transformer/config.json:3291c3a1c7adc22b8182a0de25ca8ec97474d72715ce84adbab09cc0be24f666",
    "source-sha=transformer/diffusion_pytorch_model.safetensors.index.json:b609327fc75dbe5080e7e095d8b727d74d728b4f98e8b047133b0082cfa2fb03",
    "source-sha=transformer/diffusion_pytorch_model-00001-of-00003.safetensors:e40d3444940a0b0fd7cd45ba7959a5bd3d5efd7ddf87aae5ce4d87ce8aa03d01",
    "source-sha=transformer/diffusion_pytorch_model-00002-of-00003.safetensors:d106da790ec2924ffd8af04b4ffa8f8de281a974b58e55649c3ec596dc8ef033",
    "source-sha=transformer/diffusion_pytorch_model-00003-of-00003.safetensors:11f637ab17c7093344a6110a1e87ffda8e56558dc55183d8e790222cfcdcf52d"
  ],
  "on_demand": true,
  "build": {
    "forge_version": "0.1.0",
    "tag": "",
    "date": "2026-10-25"
  }
}
